Image,Partition,Car Type,Car Side,Type Correct,Side Correct,Detection,Accuracy,Pass/Fail
Convert Front.jpg,cars,A white convertible sports car.,"The car is facing forward, with its headlights popped up and turned on. This image captures the car in a static pose, likely for display or promotional purposes, with a clean and clear background that emphasizes its design features. If you have more images or need further analysis, feel free to share them!",Correct,Correct,Yes,100.0,Pass
Convert Rear.jpg,cars,A green BMW convertible.,"The car is shown in a side view, driving along a road. The image captures a scenic drive with an open landscape of fields, trees, and a distant view of a town, under a clear and sunny sky. This makes for a picturesque setting, highlighting the design and allure of the car. If you have more images for analysis or need further details, feel free to share them!",Correct,Correct,Yes,100.0,Pass
Convert Side.jpg,cars,A classic convertible sports car.,"The car is shown from the side, highlighting its sleek and compact design. The car features smooth curves, a low profile, multi-spoke silver wheels, and pop-up headlights. The dark background makes the red color of the car stand out prominently. This image captures the aesthetic appeal and design features of a classic convertible sports car, which might be of interest to car enthusiasts or those studying automotive design. If you have more images for analysis or further questions, feel free to share them!",Correct,Correct,Yes,100.0,Pass
Sedan Front.jpg,cars,A red Honda car.,"The car is shown from the front view. The image highlights the car’s modern and sporty design, with sharp lines, sleek headlights, and fog lights integrated into the lower bumper. The prominent Honda logo in the center of the grille is clearly visible. The glossy finish and sharp lines enhance its brand identity, making it an eye-catching design. If you have more images for analysis or further questions, feel free to share them!",Correct,Correct,Yes,100.0,Pass
Sedan Rear.jpg,cars,A white Honda Accord sedan.,"The car is shown from the rear view. The image showcases the car's modern and sleek design, highlighting distinctive taillights, a Honda emblem on the trunk, dual exhaust outlets, and various model badging. This detailed view is particularly interesting for automotive enthusiasts who appreciate the aesthetics and specifications of specific car models. If you have more images for analysis or further details you need, feel free to share them!",Correct,Correct,Yes,100.0,Pass
Sedan Side.jpg,cars,A dark gray sedan.,"The car is shown from the side view. The image features a sleek and modern dark gray sedan with smooth lines and a slightly sloping roofline towards the rear. It has large wheels with a stylish multi-spoke design. The background is plain and light gray, helping to highlight the car’s features, which can be appealing to potential buyers or automotive enthusiasts. If you have more images or need further analysis, feel free to share them!",Correct,Correct,Yes,100.0,Pass
SUV Front.jpg,cars,A black Mercedes-Benz SUV.,"The car is shown from the front view. The vehicle is parked in an outdoor setting, positioned in a parking space with green lines marking the boundaries. The prominent Mercedes-Benz logo is centered on the grille, which features horizontal chrome bars. The headlights are on either side of the grille, and the front bumper has chrome accents. In the background, there are palm trees and a building, suggesting a warm, possibly coastal location. This image showcases the luxury and sleek design of the Mercedes-Benz SUV. If you have more images for analysis or need further details, feel free to share them!",Correct,Correct,Yes,100.0,Pass
SUV Rear.jpg,cars,A silver Mitsubishi Outlander SUV.,"The car is shown from the rear view. The image shows the rear view of a silver Mitsubishi Outlander SUV parked in front of a building with a gray brick wall. The vehicle has a Tennessee license plate with the number ""DL02448."" The Mitsubishi logo is prominently displayed in the center of the rear hatch, and the model name ""Outlander"" is visible on the left side of the hatch. The taillights are sleek and modern, extending horizontally across the rear of the vehicle. The rear bumper features integrated reflectors and a dual exhaust design. This image is useful for showcasing the design and features of the Mitsubishi Outlander, especially for automotive enthusiasts or potential buyers. If you have more images or need further analysis, feel free to share them!",Correct,Correct,Yes,100.0,Pass
SUV Side.jpg,cars,A white luxury SUV.,"The car is shown from the side view. The vehicle has a sleek and modern design with large alloy wheels, tinted windows, and a roof rack. The SUV appears to be a high-end model, characterized by its clean lines and stylish appearance. The background is plain white, which helps to highlight the details of the car. If you have more images for analysis or any other questions, feel free to share them!",Correct,Correct,Yes,100.0,Pass
Truck Front.jpg,cars,A RAM truck with a prominent grille.,"The front view of the truck is shown. The truck has its headlights on and boasts a shiny, reflective chrome finish. The backdrop features a corrugated metal wall, and the truck is parked on a gravel surface. This image emphasizes the bold and robust design of the RAM truck, showcasing its imposing front grille and modern lighting. If you have more images or need further analysis, feel free to share them!",Correct,Correct,Yes,100.0,Pass
Truck Rear.jpg,cars,The truck is a silver Ford F-150.,"The image shows the rear of the truck. The tailgate prominently displays the ""F-150"" model designation in large embossed letters, with the Ford logo centered above it. The truck has a California license plate, and the rear bumper is equipped with additional lights and a hitch receiver. The rear window of the truck's cab is visible, and there is a high-mounted brake light at the top of the cab. The truck is parked on a white background, making the vehicle the focal point of the image. If you have more images for analysis or any further questions, feel free to share them!",Correct,Correct,Yes,100.0,Pass
Truck Side.jpg,cars,A gray pickup truck.,"The truck is shown from the driver's side. The truck is parked in front of a brick wall and has four doors and a large bed. It features black wheels, tinted windows, and a decal on the rear side that reads ""FX4."" The truck appears to be in good condition and is parked on a paved surface. If you have more images for analysis or any further questions, feel free to share them!",Correct,Correct,Yes,100.0,Pass
Van Front.jpg,cars,A commercial van.,"The front view of the van is shown. The van features a prominent black grille, headlights on either side, and side mirrors with orange indicators. The windshield wipers are visible on the front windshield, and it appears to be a modern commercial vehicle, likely used for transporting goods or services. This image emphasizes the design and features of a commercial van, relevant for businesses or individuals looking for a reliable transportation solution. If you have more images for analysis or need further details, feel free to share them!",Correct,Correct,Yes,100.0,Pass
Van Rear.jpg,cars,A white cargo van.,"The rear view of the van is shown. The van has two large rear doors that are closed, with two black handles in the middle. The rear lights are visible on both sides of the van, and the bottom part of the van is black, including the bumper. The van is parked on a white background, making it the focal point of the image. This analysis helps highlight the key features of the white cargo van. If you have more images for analysis or need further details, feel free to share them!",Correct,Correct,Yes,100.0,Pass
Van Side.jpg,cars,A white cargo van.,"The van is shown from the driver's side. The van has a simple, clean design with no visible branding or markings. It has a black stripe running along the bottom edge of the vehicle, and the wheels are standard with hubcaps. The van's windows are only present on the front doors, with the rest of the vehicle's body being solid panels. This type of van is commonly used for transporting goods or equipment, making it relevant for businesses that require a reliable and spacious vehicle for deliveries or service calls. If you have more images for analysis or any further questions, feel free to share them!",Correct,Correct,Yes,100.0,Pass
Summary,,,,15/15 (100.00%),15/15 (100.00%),,,Pass: 15/15 (100.00%)
